"taxon_name","original_text","description","form","stem","leaf","flower","fruit","seed","root"
"Erigeron conyzoides","Slender, erect perennial (stems annual) to c. 1 m high, glabrous or with a few short hairs toward base, minutely glandular-pubescent below involucre; usually branched just below inflorescence. Leaves narrowly obovate, narrowly elliptic or oblong, 3–13 cm long, 3–12 mm wide, entire or the lowermost shallowly toothed, sometimes sparsely and minutely ciliate; margins often purplish. Inflorescence corymbose. Capitula c. hemispherical; involucral bracts linear, 3–6 mm long, minutely glandular-pubescent; ray florets 1–several-seriate, the outer with white ligules 1.5–3 mm long, more or less erect, shortly exceeding involucre. Cypselas flattened, obovate to oblong, c. 2 mm long, sparsely appressed-pubescent; pappus bristles c. uniform, 4.5–6.5 mm long. Flowers Jan.–Feb.","slender, erect perennial (stems annual) to circa 1 m high, glabrous or with a few short hairs toward base, minutely glandular-pubescent below involucre; usually branched just below inflorescence. leaves narrowly obovate, narrowly elliptic or oblong, 3–13 cm long, 3–12 mm wide, entire or the lowermost shallowly toothed, sometimes sparsely and minutely ciliate; margins often purplish. inflorescence corymbose. capitula circa hemispherical; involucral bracts linear, 3–6 mm long, minutely glandular-pubescent; ray florets 1–several-seriate, the outer with white ligules 1.5–3 mm long, more or less erect, shortly exceeding involucre. cypselas flattened, obovate to oblong, circa 2 mm long, sparsely appressed-pubescent; pappus bristles circa uniform, 4.5–6.5 mm long. flowers jan.–feb.","slender, erect perennial (stems annual) to circa 1 m high, glabrous or with a few short hairs toward base, minutely glandular-pubescent below involucre;",,"leaves narrowly obovate, narrowly elliptic or oblong, 3–13 cm long, 3–12 mm wide, entire or the lowermost shallowly toothed, sometimes sparsely and minutely ciliate; margins often purplish.","usually branched just below inflorescence. inflorescence corymbose. capitula circa hemispherical; involucral bracts linear, 3–6 mm long, minutely glandular-pubescent; ray florets 1–several-seriate, the outer with white ligules 1.5–3 mm long, more or less erect, shortly exceeding involucre. flowers jan.–feb.","cypselas flattened, obovate to oblong, circa 2 mm long, sparsely appressed-pubescent; pappus bristles circa uniform, 4.5–6.5 mm long.",,
"Eucalyptus costata subsp. costata","Fruits moderately to strongly ribbed, to 13 mm diam.","fruits moderately to strongly ribbed, to 13 mm diam.",,,,,"fruits moderately to strongly ribbed, to 13 mm diam.",,
"Agrostis stolonifera","Like A. capillaris but differing in having leafy stolons (with short rhizomes sometimes present), ligule mostly longer than wide (1.5–7 mm) and inflorescence rather dense with branches rarely exceeding 3 cm in length, bearing spikelets below halfway and pedicels scabrous throughout. Flowers Sep.–Feb.","like capillaris but differing in having leafy stolons (with short rhizomes sometimes present), ligule mostly longer than wide (1.5–7 mm) and inflorescence rather dense with branches rarely exceeding 3 cm in length, bearing spikelets below halfway and pedicels scabrous throughout. flowers sep.–feb.",,"like capillaris but differing in having leafy stolons (with short rhizomes sometimes present), ligule mostly longer than wide (1.5–7 mm) and inflorescence rather dense with branches rarely exceeding 3 cm in length, bearing spikelets below halfway and pedicels scabrous throughout.",,"flowers sep.–feb.",,,
"Borya","Tussocking or rhizomatous perennial herbs. Roots wiry, often stilt-like. Stems branched. Leaves stiff, pointed, sometimes deciduous, linear, clustered on stem apices or secund, leaf-base persistent. Inflorescence a terminal pedunculate bracteate head. Flowers bisexual, sessile, each enclosed by a bract and bracteole; perianth tubular in lower part, lobed (in 2 whorls) above; stamens 6, filaments filiform, anthers basifixed; ovary superior, 3-locular, ovules numerous, in 2 rows; stigma minute, capitate. Fruit a capsule; seeds 1–4, ornamented, black.","tussocking or rhizomatous perennial herbs. roots wiry, often stilt-like. stems branched. leaves stiff, pointed, sometimes deciduous, linear, clustered on stem apices or secund, leaf-base persistent. inflorescence a terminal pedunculate bracteate head. flowers bisexual, sessile, each enclosed by a bract and bracteole; perianth tubular in lower part, lobed (in 2 whorls) above; stamens 6, filaments filiform, anthers basifixed; ovary superior, 3-locular, ovules numerous, in 2 rows; stigma minute, capitate. fruit a capsule; seeds 1–4, ornamented, black.","tussocking or rhizomatous perennial herbs.","stems branched.","leaves stiff, pointed, sometimes deciduous, linear, clustered on stem apices or secund, leaf-base persistent.","inflorescence a terminal pedunculate bracteate head. flowers bisexual, sessile, each enclosed by a bract and bracteole; perianth tubular in lower part, lobed (in 2 whorls) above; stamens 6, filaments filiform, anthers basifixed; ovary superior, 3-locular, ovules numerous, in 2 rows; stigma minute, capitate.","fruit a capsule;","seeds 1–4, ornamented, black.","roots wiry, often stilt-like."
"Deyeuxia affinis","Narrowly tufted or shortly rhizomatous perennial, culms erect, to 20(–30) cm high. Leaf-blades stiff, folded, or the margins inrolled, smooth and glabrous on the outer (lower) surface, minutely scabrous on the margins and upper surface, to 6 cm long and c. 1 mm wide, apex often slightly thickened and bluntish; ligules truncate, minutely ciliate at apex, 1–3 mm long. Inflorescence a narrow contracted panicle 2–5 cm long. Spikelets 2.8–3.5 mm long, usually purplish at least when young; glumes narrowly acute, sometimes shortly mucronate, subequal or the upper slightly longer, scabrous along the keel in the upper part, upper margins silvery-hyaline; lemma acute, slightly shorter than the spikelet, indistinctly 5-nerved, smooth or minutely scabrous along the nerves toward the apex, not or barely hardened at maturity, awned from just below the apex; awn straight, 0.8–2 mm long, exceeding lemma by up to 1 mm; callus hairs dense, about two-thirds as long as lemma; rachilla bristle 0.5–1 mm long, plumose, with hairs nearly reaching the apex of the lemma. Flowers Jan.–Feb.","narrowly tufted or shortly rhizomatous perennial, culms erect, to 20(–30) cm high. leaf-blades stiff, folded, or the margins inrolled, smooth and glabrous on the outer (lower) surface, minutely scabrous on the margins and upper surface, to 6 cm long and circa 1 mm wide, apex often slightly thickened and bluntish; ligules truncate, minutely ciliate at apex, 1–3 mm long. inflorescence a narrow contracted panicle 2–5 cm long. spikelets 2.8–3.5 mm long, usually purplish at least when young; glumes narrowly acute, sometimes shortly mucronate, subequal or the upper slightly longer, scabrous along the keel in the upper part, upper margins silvery-hyaline; lemma acute, slightly shorter than the spikelet, indistinctly 5-nerved, smooth or minutely scabrous along the nerves toward the apex, not or barely hardened at maturity, awned from just below the apex; awn straight, 0.8–2 mm long, exceeding lemma by up to 1 mm; callus hairs dense, about two-thirds as long as lemma; rachilla bristle 0.5–1 mm long, plumose, with hairs nearly reaching the apex of the lemma. flowers jan.–feb.","narrowly tufted or shortly rhizomatous perennial, culms erect, to 20(–30) cm high.",,"leaf-blades stiff, folded, or the margins inrolled, smooth and glabrous on the outer (lower) surface, minutely scabrous on the margins and upper surface, to 6 cm long and circa 1 mm wide, apex often slightly thickened and bluntish; ligules truncate, minutely ciliate at apex, 1–3 mm long.","inflorescence a narrow contracted panicle 2–5 cm long. spikelets 2.8–3.5 mm long, usually purplish at least when young; glumes narrowly acute, sometimes shortly mucronate, subequal or the upper slightly longer, scabrous along the keel in the upper part, upper margins silvery-hyaline; flowers jan.–feb.","lemma acute, slightly shorter than the spikelet, indistinctly 5-nerved, smooth or minutely scabrous along the nerves toward the apex, not or barely hardened at maturity, awned from just below the apex; awn straight, 0.8–2 mm long, exceeding lemma by up to 1 mm; callus hairs dense, about two-thirds as long as lemma; rachilla bristle 0.5–1 mm long, plumose, with hairs nearly reaching the apex of the lemma.",,
"Isolepis fluitans var. fluitans","Culms mat-forming, creeping and procumbent, sometimes aquatic and largely floating, or erect and tufted. Involucral bract shorter than inflorescence, often glume-like.","culms mat-forming, creeping and procumbent, sometimes aquatic and largely floating, or erect and tufted. involucral bract shorter than inflorescence, often glume-like.",,"culms mat-forming, creeping and procumbent, sometimes aquatic and largely floating, or erect and tufted.",,"involucral bract shorter than inflorescence, often glume-like.",,,
"Trachyandra","Rhizomatous perennial herbs. Roots fibrous or tuberous. Leaves usually basal, linear, flat, perennial. Inflorescence a bracteate raceme or panicle; flowers bisexual, perianth segments equal, spreading, free or fused at base, 1-nerved; stamens 6, filaments subulate, scabrid, anthers dorsifixed; ovary superior, trilocular, ovules 2–16 per locule, style filiform, stigma capitate. Fruit a loculicidal capsule; seeds angled, black.","rhizomatous perennial herbs. roots fibrous or tuberous. leaves usually basal, linear, flat, perennial. inflorescence a bracteate raceme or panicle; flowers bisexual, perianth segments equal, spreading, free or fused at base, 1-nerved; stamens 6, filaments subulate, scabrid, anthers dorsifixed; ovary superior, trilocular, ovules 2–16 per locule, style filiform, stigma capitate. fruit a loculicidal capsule; seeds angled, black.","rhizomatous perennial herbs.",,"leaves usually basal, linear, flat, perennial.","inflorescence a bracteate raceme or panicle; flowers bisexual, perianth segments equal, spreading, free or fused at base, 1-nerved; stamens 6, filaments subulate, scabrid, anthers dorsifixed; ovary superior, trilocular, ovules 2–16 per locule, style filiform, stigma capitate.","fruit a loculicidal capsule;","seeds angled, black.","roots fibrous or tuberous."
"Eleocharis atricha","Slender tufted perennial, with slender rhizomes bearing ovoid tubers to c. 5 mm long and 2.5 mm diam. Culms angular-grooved, 3–40 cm high, 0.5–1.3 mm diam. Spikelet narrow-ovoid to linear, often proliferating, 10–20 mm long; glumes obtuse, narrowly keeled, red-brown, 3–5 mm long; hypogynous bristles absent; stamens 3; anthers 1.5–2.6 mm; style 3-fid. Nut obscurely trigonous, narrow-obovoid, narrowed into a short neck, prominently longitudinally ribbed, the external cells transversely linear to oblong in 4–6 vertical rows on each face, straw-coloured, 1.3–1.5 mm long, c. 0.7 mm diam.; style-base from one-sixth to one-quarter as long as and from three-quarters to four-fifths as wide as nut. Flowers spring–summer.","slender tufted perennial, with slender rhizomes bearing ovoid tubers to circa 5 mm long and 2.5 mm diam. culms angular-grooved, 3–40 cm high, 0.5–1.3 mm diam. spikelet narrow-ovoid to linear, often proliferating, 10–20 mm long; glumes obtuse, narrowly keeled, red-brown, 3–5 mm long; hypogynous bristles absent; stamens 3; anthers 1.5–2.6 mm; style 3-fid. nut obscurely trigonous, narrow-obovoid, narrowed into a short neck, prominently longitudinally ribbed, the external cells transversely linear to oblong in 4–6 vertical rows on each face, straw-coloured, 1.3–1.5 mm long, circa 0.7 mm diam.; style-base from one-sixth to one-quarter as long as and from three-quarters to four-fifths as wide as nut. flowers spring–summer.","slender tufted perennial, with slender rhizomes bearing ovoid tubers to circa 5 mm long and 2.5 mm diam.","culms angular-grooved, 3–40 cm high, 0.5–1.3 mm diam. spikelet narrow-ovoid to linear, often proliferating, 10–20 mm long; glumes obtuse, narrowly keeled, red-brown, 3–5 mm long; hypogynous bristles absent;",,"stamens 3; anthers 1.5–2.6 mm; style 3-fid. style-base from one-sixth to one-quarter as long as and from three-quarters to four-fifths as wide as nut. flowers spring–summer.","nut obscurely trigonous, narrow-obovoid, narrowed into a short neck, prominently longitudinally ribbed, the external cells transversely linear to oblong in 4–6 vertical rows on each face, straw-coloured, 1.3–1.5 mm long, circa 0.7 mm diam.;",,
"Echium","Annual or perennial herbs or shrubs, mostly covered with coarse broad-based setae and often with short patent or appressed hairs. Rosette leaves crowded, petiolate, entire; cauline leaves alternate, widely spaced, sessile. Inflorescences terminal, of few–many simple monochasial scorpioid cymes; bracts present. Flowers sessile, in 2 rows; sepals 5, often unequal, connate at base, elongating with age; corolla zygomorphic to almost regular, 5-lobed, funnel-shaped, hairy outside, glabrous inside, often with scales near base of tube, throat open, lobes spreading; stamens inserted in corolla-tube or throat, anthers ellipsoid, on long filaments, some exserted beyond throat of corolla (in Victoria) or all included; ovary 4-lobed, 4-celled, style filiform, longer than stamens; stigma 2-lobed. Fruit splitting into 4 mericarps, often fewer by abortion, leaving a short, central gynobase; mericarps ovoid, beaked, inner surface ridged, densely tuberculate, attachment scar broad, basal.","annual or perennial herbs or shrubs, mostly covered with coarse broad-based setae and often with short patent or appressed hairs. rosette leaves crowded, petiolate, entire; cauline leaves alternate, widely spaced, sessile. inflorescences terminal, of few–many simple monochasial scorpioid cymes; bracts present. flowers sessile, in 2 rows; sepals 5, often unequal, connate at base, elongating with age; corolla zygomorphic to almost regular, 5-lobed, funnel-shaped, hairy outside, glabrous inside, often with scales near base of tube, throat open, lobes spreading; stamens inserted in corolla-tube or throat, anthers ellipsoid, on long filaments, some exserted beyond throat of corolla (in victoria) or all included; ovary 4-lobed, 4-celled, style filiform, longer than stamens; stigma 2-lobed. fruit splitting into 4 mericarps, often fewer by abortion, leaving a short, central gynobase; mericarps ovoid, beaked, inner surface ridged, densely tuberculate, attachment scar broad, basal.","annual or perennial herbs or shrubs, mostly covered with coarse broad-based setae and often with short patent or appressed hairs.",,"rosette leaves crowded, petiolate, entire; cauline leaves alternate, widely spaced, sessile.","inflorescences terminal, of few–many simple monochasial scorpioid cymes; bracts present. flowers sessile, in 2 rows; sepals 5, often unequal, connate at base, elongating with age; corolla zygomorphic to almost regular, 5-lobed, funnel-shaped, hairy outside, glabrous inside, often with scales near base of tube, throat open, lobes spreading; stamens inserted in corolla-tube or throat, anthers ellipsoid, on long filaments, some exserted beyond throat of corolla (in victoria) or all included; ovary 4-lobed, 4-celled, style filiform, longer than stamens; stigma 2-lobed.","fruit splitting into 4 mericarps, often fewer by abortion, leaving a short, central gynobase; mericarps ovoid, beaked, inner surface ridged, densely tuberculate, attachment scar broad, basal.",,
"Juncus pallidus","Tufted robust perennial with horizontal or ascending rhizomes. Cataphylls broad, obtuse, loose or tight, pale to dark brown towards the base, to c. 40 cm long. Culms erect, sometimes faintly glaucous when immature, usually bluish-green to dull green at maturity, 50–220 cm high and (2.5–)3.0–8.0 mm diam.; striations 50–100, not strongly raised to moderately strongly raised; pith moderately dense, continuous; stomates superficial. Inflorescence with flowers typically scattered or occasionally clustered (but not forming distinct subglobular clusters); primary bract continuous with culm, to c. 35 cm long; prophylls present. Tepals stramineous or midrib occasionally reddish tinged, 2.6–3.5 mm long; stamens 6, anthers 0.5–0.9 mm long. Capsules golden-brown, longer than or equal to the tepals, 2.8–3.5 mm long. Pale Rush Flowers mostly Oct.–Jan., seeds shed mostly Dec.–Apr.","tufted robust perennial with horizontal or ascending rhizomes. cataphylls broad, obtuse, loose or tight, pale to dark brown towards the base, to circa 40 cm long. culms erect, sometimes faintly glaucous when immature, usually bluish-green to dull green at maturity, 50–220 cm high and (2.5–)3.0–8.0 mm diam.; striations 50–100, not strongly raised to moderately strongly raised; pith moderately dense, continuous; stomates superficial. inflorescence with flowers typically scattered or occasionally clustered (but not forming distinct subglobular clusters); primary bract continuous with culm, to circa 35 cm long; prophylls present. tepals stramineous or midrib occasionally reddish tinged, 2.6–3.5 mm long; stamens 6, anthers 0.5–0.9 mm long. capsules golden-brown, longer than or equal to the tepals, 2.8–3.5 mm long. pale rush flowers mostly oct.–jan., seeds shed mostly dec.–apr.","tufted robust perennial with horizontal or ascending rhizomes.","culms erect, sometimes faintly glaucous when immature, usually bluish-green to dull green at maturity, 50–220 cm high and (2.5–)3.0–8.0 mm diam.; striations 50–100, not strongly raised to moderately strongly raised; pith moderately dense, continuous; stomates superficial.","cataphylls broad, obtuse, loose or tight, pale to dark brown towards the base, to circa 40 cm long.","inflorescence with flowers typically scattered or occasionally clustered (but not forming distinct subglobular clusters); primary bract continuous with culm, to circa 35 cm long; prophylls present. tepals stramineous or midrib occasionally reddish tinged, 2.6–3.5 mm long; stamens 6, anthers 0.5–0.9 mm long. pale rush flowers mostly oct.–jan., seeds shed mostly dec.–apr.","capsules golden-brown, longer than or equal to the tepals, 2.8–3.5 mm long.",,
"Hymenophyllum","Small epiphytic, lithophytic or terrestrial ferns. Rhizome creeping, narrow or wiry, rarely stout. Lamina simple or pinnately divided, with single vein; margins entire or with minute teeth, glabrous. Sori terminal on ultimate segments or on rows of 1–3 short branchlets on upper side of each secondary rachis; indusium divided to middle or base, sometimes forming tube for part of length, lips toothed or smooth. Receptacle included or very slightly exserted. Sporangia large.","small epiphytic, lithophytic or terrestrial ferns. rhizome creeping, narrow or wiry, rarely stout. lamina simple or pinnately divided, with single vein; margins entire or with minute teeth, glabrous. sori terminal on ultimate segments or on rows of 1–3 short branchlets on upper side of each secondary rachis; indusium divided to middle or base, sometimes forming tube for part of length, lips toothed or smooth. receptacle included or very slightly exserted. sporangia large.","small epiphytic, lithophytic or terrestrial ferns.",,"lamina simple or pinnately divided, with single vein; margins entire or with minute teeth, glabrous.","receptacle included or very slightly exserted.","sori terminal on ultimate segments or on rows of 1–3 short branchlets on upper side of each secondary rachis; indusium divided to middle or base, sometimes forming tube for part of length, lips toothed or smooth. sporangia large.",,"rhizome creeping, narrow or wiry, rarely stout."
"Gladiolus tristis","Corm with outer layers papery to woody. Stem unbranched, with 2 or 3 reduced leaves. Basal leaf 1, narrowly linear, 2–4 mm wide, cross-shaped in section, with thickened midrib and margin. Inflorescence with flowers secund, 2–7-flowered. Flowers funnel-shaped, dull yellow with a dark line on each perianth lobe, veining often blackish green or lobe with darkly speckled, sometimes with deeper yellow mid-vein, strongly aromatic at night. Perianth tube 4–6 cm long, widened at mouth, curved; lobes with margin and apex flat, sub-equal, spreading; adaxial lobe not or only slightly hood-shaped. Anthers 12–14 mm long. Style branches ± level with anthers. Flowers Sep.–Oct.","corm with outer layers papery to woody. stem unbranched, with 2 or 3 reduced leaves. basal leaf 1, narrowly linear, 2–4 mm wide, cross-shaped in section, with thickened midrib and margin. inflorescence with flowers secund, 2–7-flowered. flowers funnel-shaped, dull yellow with a dark line on each perianth lobe, veining often blackish green or lobe with darkly speckled, sometimes with deeper yellow mid-vein, strongly aromatic at night. perianth tube 4–6 cm long, widened at mouth, curved; lobes with margin and apex flat, sub-equal, spreading; adaxial lobe not or only slightly hood-shaped. anthers 12–14 mm long. style branches ± level with anthers. flowers sep.–oct.",,"stem unbranched, with 2 or 3 reduced leaves.","basal leaf 1, narrowly linear, 2–4 mm wide, cross-shaped in section, with thickened midrib and margin.","inflorescence with flowers secund, 2–7-flowered. flowers funnel-shaped, dull yellow with a dark line on each perianth lobe, veining often blackish green or lobe with darkly speckled, sometimes with deeper yellow mid-vein, strongly aromatic at night. perianth tube 4–6 cm long, widened at mouth, curved; lobes with margin and apex flat, sub-equal, spreading; adaxial lobe not or only slightly hood-shaped. anthers 12–14 mm long. style branches ± level with anthers. flowers sep.–oct.",,,"corm with outer layers papery to woody."
"Goodenia blackiana","Prostrate to ascending perennial to 20 cm high; stems to 20 cm long, usually stoloniferous, pubescent. Leaves mainly basal, obovate to oblanceolate, 2–6 cm long, 5–15 mm wide, acute or obtuse, upper surface glabrescent, lower surface white cottony-tomentose, rarely glabrescent, margins dentate, base attenuate into an indistinct petiole; cauline leaves smaller. Inflorescences terminal racemes to 5 cm long, or flowers solitary in axils; peduncle 3–5 cm long, often geniculate at bracteoles at anthesis; pedicels 30–50 mm long; bracteoles linear, 5–12 mm long. Sepals narrow-oblong to ovate, 4–5 mm long; corolla 13–14 mm long, pubescent outside and inside, yellow, abaxial lobes 5–6 mm long, wings c. 2 mm wide; indusium broad-oblong, concave; ovules 12–18. Fruit ovoid, to c. 10 mm long, valves shallowly bifid; seeds elliptic, c. 3 mm long, papillose, yellowish, wing vestigial. Flowers mainly Aug.–Jan.","prostrate to ascending perennial to 20 cm high; stems to 20 cm long, usually stoloniferous, pubescent. leaves mainly basal, obovate to oblanceolate, 2–6 cm long, 5–15 mm wide, acute or obtuse, upper surface glabrescent, lower surface white cottony-tomentose, rarely glabrescent, margins dentate, base attenuate into an indistinct petiole; cauline leaves smaller. inflorescences terminal racemes to 5 cm long, or flowers solitary in axils; peduncle 3–5 cm long, often geniculate at bracteoles at anthesis; pedicels 30–50 mm long; bracteoles linear, 5–12 mm long. sepals narrow-oblong to ovate, 4–5 mm long; corolla 13–14 mm long, pubescent outside and inside, yellow, abaxial lobes 5–6 mm long, wings circa 2 mm wide; indusium broad-oblong, concave; ovules 12–18. fruit ovoid, to circa 10 mm long, valves shallowly bifid; seeds elliptic, circa 3 mm long, papillose, yellowish, wing vestigial. flowers mainly aug.–jan.","prostrate to ascending perennial to 20 cm high;","stems to 20 cm long, usually stoloniferous, pubescent.","leaves mainly basal, obovate to oblanceolate, 2–6 cm long, 5–15 mm wide, acute or obtuse, upper surface glabrescent, lower surface white cottony-tomentose, rarely glabrescent, margins dentate, base attenuate into an indistinct petiole; cauline leaves smaller.","inflorescences terminal racemes to 5 cm long, or flowers solitary in axils; peduncle 3–5 cm long, often geniculate at bracteoles at anthesis; pedicels 30–50 mm long; bracteoles linear, 5–12 mm long. sepals narrow-oblong to ovate, 4–5 mm long; corolla 13–14 mm long, pubescent outside and inside, yellow, abaxial lobes 5–6 mm long, wings circa 2 mm wide; indusium broad-oblong, concave; ovules 12–18. flowers mainly aug.–jan.","fruit ovoid, to circa 10 mm long, valves shallowly bifid;","seeds elliptic, circa 3 mm long, papillose, yellowish, wing vestigial.",
