"taxon_name","original_text","description","form","stem","leaf","flower","fruit","seed","root"
"Cyperus pygmaeus","Small, tufted, leafy annual with reddish roots. Culms triquetrous, smooth, 1–20 cm high, to 1.5 mm diam. Leaves not septate-nodulose, usually longer than culms, 1–2 mm wide. Inflorescence densely head-like, 6–18 mm diam.; involucral bracts leaf-like, 5–7 or more, spreading, very much longer than inflorescence, often a few smaller bracts protruding from the head. Spikelets flattened, very numerous per cluster, 3–5 mm long, 1.5–2 mm wide in side view, 8–20-flowered; rachilla not winged, persistent; glumes acute, short-mucronate, with sides 1–2-nerved, white to pale brown with conspicuous green keel, c.2 mm long, c. 0.5 mm wide; stamens 1 or 2; style 2(–3)-fid. Nut dorsally flattened with a flat or concave face against the rachilla, or sometimes trigonous, obovoid to ellipsoid, pale brown, from one-half to one-third as long as glume, 0.8–1 mm long, 0.2–0.5 mm diam. Flowers spring–summer.","small, tufted, leafy annual with reddish roots. culms triquetrous, smooth, 1–20 cm high, to 1.5 mm diam. leaves not septate-nodulose, usually longer than culms, 1–2 mm wide. inflorescence densely head-like, 6–18 mm diam.; involucral bracts leaf-like, 5–7 or more, spreading, very much longer than inflorescence, often a few smaller bracts protruding from the head. spikelets flattened, very numerous per cluster, 3–5 mm long, 1.5–2 mm wide in side view, 8–20-flowered; rachilla not winged, persistent; glumes acute, short-mucronate, with sides 1–2-nerved, white to pale brown with conspicuous green keel, circa2 mm long, circa 0.5 mm wide; stamens 1 or 2; style 2(–3)-fid. nut dorsally flattened with a flat or concave face against the rachilla, or sometimes trigonous, obovoid to ellipsoid, pale brown, from one-half to one-third as long as glume, 0.8–1 mm long, 0.2–0.5 mm diam. flowers spring–summer.","small, tufted, leafy annual with reddish roots.","culms triquetrous, smooth, 1–20 cm high, to 1.5 mm diam.","leaves not septate-nodulose, usually longer than culms, 1–2 mm wide.","inflorescence densely head-like, 6–18 mm diam.; involucral bracts leaf-like, 5–7 or more, spreading, very much longer than inflorescence, often a few smaller bracts protruding from the head. spikelets flattened, very numerous per cluster, 3–5 mm long, 1.5–2 mm wide in side view, 8–20-flowered; rachilla not winged, persistent; glumes acute, short-mucronate, with sides 1–2-nerved, white to pale brown with conspicuous green keel, circa2 mm long, circa 0.5 mm wide; stamens 1 or 2; style 2(–3)-fid. flowers spring–summer.","nut dorsally flattened with a flat or concave face against the rachilla, or sometimes trigonous, obovoid to ellipsoid, pale brown, from one-half to one-third as long as glume, 0.8–1 mm long, 0.2–0.5 mm diam.",,
"Maurandya","Scandent or climbing herbaceous annuals or perennials with fibrous roots or tap-roots. Leaves alternate, hastate to broadly sagittate, rarely cordate, glabrous, margins entire or rarely broadly crenate, petiolate; petioles twining. Flowers solitary, axillary, pedicellate. Sepals 5, free, lanceolate; corolla 2-lipped, pink, 5-lobed, upper 2 recurved, lower 3 recurved or projecting forwards, red, blue, blue-violet or violet with whitish base; stamens 4, in pairs of unequal length, included, staminode 1, rudimentary; stigma conical, shallowly grooved. Capsule 2-valved, irregularly ovoid, triangular-ovoid or globose, loculicidal; seeds numerous, winged and minutely tuberculate or not winged and tuberculate to crested.","scandent or climbing herbaceous annuals or perennials with fibrous roots or tap-roots. leaves alternate, hastate to broadly sagittate, rarely cordate, glabrous, margins entire or rarely broadly crenate, petiolate; petioles twining. flowers solitary, axillary, pedicellate. sepals 5, free, lanceolate; corolla 2-lipped, pink, 5-lobed, upper 2 recurved, lower 3 recurved or projecting forwards, red, blue, blue-violet or violet with whitish base; stamens 4, in pairs of unequal length, included, staminode 1, rudimentary; stigma conical, shallowly grooved. capsule 2-valved, irregularly ovoid, triangular-ovoid or globose, loculicidal; seeds numerous, winged and minutely tuberculate or not winged and tuberculate to crested.","scandent or climbing herbaceous annuals or perennials with fibrous roots or tap-roots.",,"leaves alternate, hastate to broadly sagittate, rarely cordate, glabrous, margins entire or rarely broadly crenate, petiolate; petioles twining.","flowers solitary, axillary, pedicellate. sepals 5, free, lanceolate; corolla 2-lipped, pink, 5-lobed, upper 2 recurved, lower 3 recurved or projecting forwards, red, blue, blue-violet or violet with whitish base; stamens 4, in pairs of unequal length, included, staminode 1, rudimentary; stigma conical, shallowly grooved.","capsule 2-valved, irregularly ovoid, triangular-ovoid or globose, loculicidal;","seeds numerous, winged and minutely tuberculate or not winged and tuberculate to crested.",
"Plectorrhiza tridentata","Leaves 3–13, narrowly elliptic to narrowly oblong-obovate, straight or slightly curved, tapered at both ends, apex acute, 3–10 cm long, 4–10 mm wide. Racemes 1–6, pendulous, 2.5–7 cm long; pedicels (including ovary) 3–6 mm long, subtending bract triangular; flowers 3–8, green and reddish-brown. Sepals and petals oblong, oblong-obovate or elliptic, apex blunt to acuminate, 3–6 mm long, petals slightly narrower than sepals. Labellum 4–5 mm long (including spur), creamy or whitish; lateral lobes triangular or slightly sickle-shaped, directed outward and forward; mid-lobe rounded, c. 1.5 mm long; spur prominent, blunt, deflexed, hollow, 2–3 mm long. Flowers Oct.–Dec.","leaves 3–13, narrowly elliptic to narrowly oblong-obovate, straight or slightly curved, tapered at both ends, apex acute, 3–10 cm long, 4–10 mm wide. racemes 1–6, pendulous, 2.5–7 cm long; pedicels (including ovary) 3–6 mm long, subtending bract triangular; flowers 3–8, green and reddish-brown. sepals and petals oblong, oblong-obovate or elliptic, apex blunt to acuminate, 3–6 mm long, petals slightly narrower than sepals. labellum 4–5 mm long (including spur), creamy or whitish; lateral lobes triangular or slightly sickle-shaped, directed outward and forward; mid-lobe rounded, circa 1.5 mm long; spur prominent, blunt, deflexed, hollow, 2–3 mm long. flowers oct.–dec.",,,"leaves 3–13, narrowly elliptic to narrowly oblong-obovate, straight or slightly curved, tapered at both ends, apex acute, 3–10 cm long, 4–10 mm wide.","racemes 1–6, pendulous, 2.5–7 cm long; pedicels (including ovary) 3–6 mm long, subtending bract triangular; flowers 3–8, green and reddish-brown. sepals and petals oblong, oblong-obovate or elliptic, apex blunt to acuminate, 3–6 mm long, petals slightly narrower than sepals. labellum 4–5 mm long (including spur), creamy or whitish; lateral lobes triangular or slightly sickle-shaped, directed outward and forward; mid-lobe rounded, circa 1.5 mm long; spur prominent, blunt, deflexed, hollow, 2–3 mm long. flowers oct.–dec.",,,
"Pinus pinaster","Tree up to 40 m tall. Bark reddish-brown, in plates, deeply fissured. Winter buds 18–25 mm long, not resinous; scales deciduous, fringed and recurved. Leaves in pairs, usually 15–30 cm long, dark green. Female cones 1–3(rarely more) together, sessile, bright-brown, shining, ovoid-conic, 9–25 cm long, usually deciduous; exposed portion of scale angular with prominent conical dorsal protuberance. Seed with a well-developed wing.","tree up to 40 m tall. bark reddish-brown, in plates, deeply fissured. winter buds 18–25 mm long, not resinous; scales deciduous, fringed and recurved. leaves in pairs, usually 15–30 cm long, dark green. female cones 1–3(rarely more) together, sessile, bright-brown, shining, ovoid-conic, 9–25 cm long, usually deciduous; exposed portion of scale angular with prominent conical dorsal protuberance. seed with a well-developed wing.","tree up to 40 m tall.","bark reddish-brown, in plates, deeply fissured. winter buds 18–25 mm long, not resinous; scales deciduous, fringed and recurved.","leaves in pairs, usually 15–30 cm long, dark green.",,"female cones 1–3(rarely more) together, sessile, bright-brown, shining, ovoid-conic, 9–25 cm long, usually deciduous; exposed portion of scale angular with prominent conical dorsal protuberance.","seed with a well-developed wing.",
"Eucalyptus globulus subsp. bicostata","Tree to 45 m tall, differing from subsp. globulus in the 3-flowered inflorescences and from subsp. pseudoglobulus in the sessile buds (to 1.7 cm long, 1.3 cm diam.), the placentae with 6(8) vertical rows of ovules, and fruit (to 1.7 cm long, 2 cm diam.), and from both in its non-coastal distribution.  Flowers Jan.–Feb.","tree to 45 m tall, differing from subsp globulus in the 3-flowered inflorescences and from subsp pseudoglobulus in the sessile buds (to 1.7 cm long, 1.3 cm diam.), the placentae with 6(8) vertical rows of ovules, and fruit (to 1.7 cm long, 2 cm diam.), and from both in its non-coastal distribution.  flowers jan.–feb.","tree to 45 m tall, differing from subsp globulus in the 3-flowered inflorescences and from subsp pseudoglobulus in the sessile buds (to 1.7 cm long, 1.3 cm diam.), the placentae with 6(8) vertical rows of ovules, and fruit (to 1.7 cm long, 2 cm diam.), and from both in its non-coastal distribution.",,,"flowers jan.–feb.",,,
"Lomandra micrantha","Tussocks small. Leaves flat, plano-convex to terete, 20–70 cm long, up to 5 mm wide, red-brown basally; basal sheath gradually tapering distally, usually torn, dark to light brown; apex broadly acute to obtuse. Male and female inflorescences dissimilar, up to 0.3–0.75 times as long as the leaves; axes smooth, slightly scabrid or conspicuously covered with wart-like projections; non-flowering axis hidden or exposed for 0.5–2.5 cm. Male inflorescences branched, 6–27 cm long, c. one- to three-quarters as long as the leaves; flower-bearing axis 3–15 cm long; flowers separate or in pairs. Female inflorescences branched or unbranched, 3–18 cm long; flower-bearing axis 3–5 cm long; flowers separate. Bracts 1–3 mm long, pale brown to translucent. Flowers pedicellate, greenish-yellow to dark red; perianth segments similar, spreading or reflexed at anthesis; male flowers separate or in pairs, 1.5–3 mm long; female flowers separate, 3–5.5 mm long.","tussocks small. leaves flat, plano-convex to terete, 20–70 cm long, up to 5 mm wide, red-brown basally; basal sheath gradually tapering distally, usually torn, dark to light brown; apex broadly acute to obtuse. male and female inflorescences dissimilar, up to 0.3–0.75 times as long as the leaves; axes smooth, slightly scabrid or conspicuously covered with wart-like projections; non-flowering axis hidden or exposed for 0.5–2.5 cm. male inflorescences branched, 6–27 cm long, circa one- to three-quarters as long as the leaves; flower-bearing axis 3–15 cm long; flowers separate or in pairs. female inflorescences branched or unbranched, 3–18 cm long; flower-bearing axis 3–5 cm long; flowers separate. bracts 1–3 mm long, pale brown to translucent. flowers pedicellate, greenish-yellow to dark red; perianth segments similar, spreading or reflexed at anthesis; male flowers separate or in pairs, 1.5–3 mm long; female flowers separate, 3–5.5 mm long.","tussocks small.",,"leaves flat, plano-convex to terete, 20–70 cm long, up to 5 mm wide, red-brown basally; basal sheath gradually tapering distally, usually torn, dark to light brown; apex broadly acute to obtuse.","male and female inflorescences dissimilar, up to 0.3–0.75 times as long as the leaves; axes smooth, slightly scabrid or conspicuously covered with wart-like projections; non-flowering axis hidden or exposed for 0.5–2.5 cm. male inflorescences branched, 6–27 cm long, circa one- to three-quarters as long as the leaves; flower-bearing axis 3–15 cm long; flowers separate or in pairs. female inflorescences branched or unbranched, 3–18 cm long; flower-bearing axis 3–5 cm long; flowers separate. bracts 1–3 mm long, pale brown to translucent. flowers pedicellate, greenish-yellow to dark red; perianth segments similar, spreading or reflexed at anthesis; male flowers separate or in pairs, 1.5–3 mm long; female flowers separate, 3–5.5 mm long.",,,
"Lysimachia vulgaris var. davurica","Leaves narrowly lanceolate, 3.5–8 cm long, 6–15 mm wide, glabrous on lower surface or minutely glandular-pubescent toward base, wiith hairs c. 0.1 mm long. Flowers Feb.–Mar. (New South Wales specimens)","leaves narrowly lanceolate, 3.5–8 cm long, 6–15 mm wide, glabrous on lower surface or minutely glandular-pubescent toward base, wiith hairs circa 0.1 mm long. flowers feb.–mar. (new south wales specimens)",,,"leaves narrowly lanceolate, 3.5–8 cm long, 6–15 mm wide, glabrous on lower surface or minutely glandular-pubescent toward base, wiith hairs circa 0.1 mm long.","flowers feb.–mar. (new south wales specimens)",,,
"Juncus revolutus","Long-rhizomatous perennial with leafy shoots usually rather distant. Culms erect, 1.5–28 cm high, each with up to c. 7 leaves and 1–4 cataphylls towards the base, rarely also with a cauline leaf, fibrous remains of old cataphylls ± persisting. Leaf-blades solid, longer or shorter than the culms, 0.5–1.3(–2) mm wide, flat or shallowly channelled, at least the midrib raised on the underside, apex acute or obtuse; auricles obtuse, to 0.8 mm long. Inflorescence few flowered, the flowers spaced along the ascending branches, or rarely 2 flowers close together; primary bract leaf-like, ± exceeding the inflorescence; prophylls present. Tepals with a broad green midrib when young, margins membranous, contrasting reddish-brown; outer tepals 4–6 mm long, with strongly incurved (and hooded) acute tips; inner shorter or equal to the outer, acute or obtuse; stamens 6, anthers 1.1–2 mm long. Capsules light brown at maturity, ellipsoid-ovoid, c. 3.8–5 mm long, obtuse or truncate ± with a fragile mucro, shorter than, equal to or slightly exceeding the tepals; seeds c. 0.5–0.7 mm long, slightly asymmetrical with very fine longitudinal and transverse ridges discernible only at high magnification, minutely apiculate at one or both ends. Flowers Oct.–Jan., seeds shed mainly Dec.–Apr.","long-rhizomatous perennial with leafy shoots usually rather distant. culms erect, 1.5–28 cm high, each with up to circa 7 leaves and 1–4 cataphylls towards the base, rarely also with a cauline leaf, fibrous remains of old cataphylls ± persisting. leaf-blades solid, longer or shorter than the culms, 0.5–1.3(–2) mm wide, flat or shallowly channelled, at least the midrib raised on the underside, apex acute or obtuse; auricles obtuse, to 0.8 mm long. inflorescence few flowered, the flowers spaced along the ascending branches, or rarely 2 flowers close together; primary bract leaf-like, ± exceeding the inflorescence; prophylls present. tepals with a broad green midrib when young, margins membranous, contrasting reddish-brown; outer tepals 4–6 mm long, with strongly incurved (and hooded) acute tips; inner shorter or equal to the outer, acute or obtuse; stamens 6, anthers 1.1–2 mm long. capsules light brown at maturity, ellipsoid-ovoid, circa 3.8–5 mm long, obtuse or truncate ± with a fragile mucro, shorter than, equal to or slightly exceeding the tepals; seeds circa 0.5–0.7 mm long, slightly asymmetrical with very fine longitudinal and transverse ridges discernible only at high magnification, minutely apiculate at one or both ends. flowers oct.–jan., seeds shed mainly dec.–apr.","long-rhizomatous perennial with leafy shoots usually rather distant.","culms erect, 1.5–28 cm high, each with up to circa 7 leaves and 1–4 cataphylls towards the base, rarely also with a cauline leaf, fibrous remains of old cataphylls ± persisting.","leaf-blades solid, longer or shorter than the culms, 0.5–1.3(–2) mm wide, flat or shallowly channelled, at least the midrib raised on the underside, apex acute or obtuse; auricles obtuse, to 0.8 mm long.","inflorescence few flowered, the flowers spaced along the ascending branches, or rarely 2 flowers close together; primary bract leaf-like, ± exceeding the inflorescence; prophylls present. tepals with a broad green midrib when young, margins membranous, contrasting reddish-brown; outer tepals 4–6 mm long, with strongly incurved (and hooded) acute tips; inner shorter or equal to the outer, acute or obtuse; stamens 6, anthers 1.1–2 mm long. flowers oct.–jan., seeds shed mainly dec.–apr.","capsules light brown at maturity, ellipsoid-ovoid, circa 3.8–5 mm long, obtuse or truncate ± with a fragile mucro, shorter than, equal to or slightly exceeding the tepals;","seeds circa 0.5–0.7 mm long, slightly asymmetrical with very fine longitudinal and transverse ridges discernible only at high magnification, minutely apiculate at one or both ends.",
"Cotoneaster pannosus","Semi-evergreen shrub 1–3.5 m high with arching branches; new growth tomentose. Leaves simple, elliptic, mostly 15–25 mm long, 8–15 mm wide, base cuneate, apex acute or obtuse, mucronate, upper surface green, dull, glabrescent, lower surface paler, white-tomentose; petiole 4–8 mm long; stipules linear-lanceolate, membranous. Inflorescence a 6–20-flowered cluster; pedicels 1–2 mm long, tomentose. Sepals 5, pubescent; petals 5, suborbicular, 3–4 mm long, clawed, white. Pome ovoid to subglobose, 6–7 mm diam., glabrescent, red; seeds 2. Flowers spring–summer.","semi-evergreen shrub 1–3.5 m high with arching branches; new growth tomentose. leaves simple, elliptic, mostly 15–25 mm long, 8–15 mm wide, base cuneate, apex acute or obtuse, mucronate, upper surface green, dull, glabrescent, lower surface paler, white-tomentose; petiole 4–8 mm long; stipules linear-lanceolate, membranous. inflorescence a 6–20-flowered cluster; pedicels 1–2 mm long, tomentose. sepals 5, pubescent; petals 5, suborbicular, 3–4 mm long, clawed, white. pome ovoid to subglobose, 6–7 mm diam., glabrescent, red; seeds 2. flowers spring–summer.","semi-evergreen shrub 1–3.5 m high with arching branches; new growth tomentose.","stipules linear-lanceolate, membranous.","leaves simple, elliptic, mostly 15–25 mm long, 8–15 mm wide, base cuneate, apex acute or obtuse, mucronate, upper surface green, dull, glabrescent, lower surface paler, white-tomentose; petiole 4–8 mm long;","inflorescence a 6–20-flowered cluster; pedicels 1–2 mm long, tomentose. sepals 5, pubescent; petals 5, suborbicular, 3–4 mm long, clawed, white. flowers spring–summer.","pome ovoid to subglobose, 6–7 mm diam., glabrescent, red;","seeds 2.",
"Taraxacum sect. Taraxacum","Leaves lanceolate to oblanceolate, c. 8–30 cm long, arachnoid-hairy to glabrescent; deeply lobed, usually with complex further dissection; petioles winged or unwinged, reddish on one or both sides (but see note below). Scapes to 40 cm long. Capitula 4.5 cm diam. or more; outermost involucral bracts erecto-patent to abruptly reflexed, uniformly or variously oriented in a single capitulum, lanceolate to linear-lanceolate, c. 8–12 mm long (in Victoria), white borders absent or very narrow (less than 0.2 mm wide), not callus-tipped. Marginal ligules far exceeding involucre; pollen usually present; stigmas yellow, yellowish-green or grey. Cypselas turbinate, 3.5–4 mm long, grey-brown to straw-coloured, spinulose at apex, smooth in lower two thirds; cone conical, 0.2–0.5 (–0.8) mm long; beak longer than cypsela body; pappus 5–6 mm long. Flowers Sept.-Apr.","leaves lanceolate to oblanceolate, circa 8–30 cm long, arachnoid-hairy to glabrescent; deeply lobed, usually with complex further dissection; petioles winged or unwinged, reddish on one or both sides (but see note below). scapes to 40 cm long. capitula 4.5 cm diam. or more; outermost involucral bracts erecto-patent to abruptly reflexed, uniformly or variously oriented in a single capitulum, lanceolate to linear-lanceolate, circa 8–12 mm long (in victoria), white borders absent or very narrow (less than 0.2 mm wide), not callus-tipped. marginal ligules far exceeding involucre; pollen usually present; stigmas yellow, yellowish-green or grey. cypselas turbinate, 3.5–4 mm long, grey-brown to straw-coloured, spinulose at apex, smooth in lower two thirds; cone conical, 0.2–0.5 (–0.8) mm long; beak longer than cypsela body; pappus 5–6 mm long. flowers sept.-apr.",,"scapes to 40 cm long.","leaves lanceolate to oblanceolate, circa 8–30 cm long, arachnoid-hairy to glabrescent; deeply lobed, usually with complex further dissection; petioles winged or unwinged, reddish on one or both sides (but see note below).","capitula 4.5 cm diam. or more; outermost involucral bracts erecto-patent to abruptly reflexed, uniformly or variously oriented in a single capitulum, lanceolate to linear-lanceolate, circa 8–12 mm long (in victoria), white borders absent or very narrow (less than 0.2 mm wide), not callus-tipped. marginal ligules far exceeding involucre; pollen usually present; stigmas yellow, yellowish-green or grey. flowers sept.-apr.","cypselas turbinate, 3.5–4 mm long, grey-brown to straw-coloured, spinulose at apex, smooth in lower two thirds; cone conical, 0.2–0.5 (–0.8) mm long; beak longer than cypsela body; pappus 5–6 mm long.",,
"Telopea oreades","Slender much-branched shrub or tree to c. 12 m high, rarely taller, glabrous. Leaves narrowly obovate to oblanceolate, 10–30 cm long, 15–60 mm wide, dull dark green, surfaces granular when dried, venation most obvious on lower surface; apex broadly acute; margins entire; petiole 10–25 mm long. Inflorescence a compact, 30–60-flowered raceme or head, to c. 10 cm across; involucral bracts linear or lanceolate, mostly 2–5 cm long, pink, red or greenish, caducous; pedicels 10–20 mm long. Tepals 20–25 mm long, crimson, rarely white, glabrous. Follicle 5–7.5 cm long, excluding the persistent style, leathery, dark brown; seeds 10–16 per follicle, to c. 45 mm long including wing. Flowers Sep.–Dec.","slender much-branched shrub or tree to circa 12 m high, rarely taller, glabrous. leaves narrowly obovate to oblanceolate, 10–30 cm long, 15–60 mm wide, dull dark green, surfaces granular when dried, venation most obvious on lower surface; apex broadly acute; margins entire; petiole 10–25 mm long. inflorescence a compact, 30–60-flowered raceme or head, to circa 10 cm across; involucral bracts linear or lanceolate, mostly 2–5 cm long, pink, red or greenish, caducous; pedicels 10–20 mm long. tepals 20–25 mm long, crimson, rarely white, glabrous. follicle 5–7.5 cm long, excluding the persistent style, leathery, dark brown; seeds 10–16 per follicle, to circa 45 mm long including wing. flowers sep.–dec.","slender much-branched shrub or tree to circa 12 m high, rarely taller, glabrous.",,"leaves narrowly obovate to oblanceolate, 10–30 cm long, 15–60 mm wide, dull dark green, surfaces granular when dried, venation most obvious on lower surface; apex broadly acute; margins entire; petiole 10–25 mm long.","inflorescence a compact, 30–60-flowered raceme or head, to circa 10 cm across; involucral bracts linear or lanceolate, mostly 2–5 cm long, pink, red or greenish, caducous; pedicels 10–20 mm long. tepals 20–25 mm long, crimson, rarely white, glabrous. flowers sep.–dec.","follicle 5–7.5 cm long, excluding the persistent style, leathery, dark brown;","seeds 10–16 per follicle, to circa 45 mm long including wing.",
"Romulea rosea var. reflexa","Leaves up to 1 mm diam., suberect, subterete, with narrow grooves. Scape 3–12 cm long. Flowers 25–38 mm long; perianth tube 3–5 mm long, yellow to orange; lobes (4–)6–10 mm wide, magenta, often violet-blue at throat, outer surface intricately indigo-veined. Stamens 7–12 mm long; stigmas usually not overtopping anthers. Flowers Sept.–Oct.","leaves up to 1 mm diam., suberect, subterete, with narrow grooves. scape 3–12 cm long. flowers 25–38 mm long; perianth tube 3–5 mm long, yellow to orange; lobes (4–)6–10 mm wide, magenta, often violet-blue at throat, outer surface intricately indigo-veined. stamens 7–12 mm long; stigmas usually not overtopping anthers. flowers sept.–oct.",,"scape 3–12 cm long.","leaves up to 1 mm diam., suberect, subterete, with narrow grooves.","flowers 25–38 mm long; perianth tube 3–5 mm long, yellow to orange; lobes (4–)6–10 mm wide, magenta, often violet-blue at throat, outer surface intricately indigo-veined. stamens 7–12 mm long; stigmas usually not overtopping anthers. flowers sept.–oct.",,,
