"taxon_name","original_text","description","form","stem","leaf","flower","fruit","seed","root"
"Mimulus","Perennial or annual herbs, conspicuously or obscurely gland-dotted. Leaves opposite or whorled, simple, sessile or petiolate, often joined across at nodes. Inflorescences a single flower or of racemes with flowers single in the axils of leaf-like bracts; bracteoles absent. Calyx-tube 5-angled, shortly 5-toothed; corolla 5-lobed, more or less rotate or 2-lipped, tube symmetrical at base, neither swollen nor spurred, upper lip 2-lobed, lower 3-lobed, longer, with a palate; stamens 4, in pairs of unequal length, filaments not spurred, anthers of each pair joined, with 2 confluent but divergent locules, staminodes absent; stigma with 2 broad equal flaps, receptive on the inner surface and irritable, closing together when touched. Capsule loculicidal, included in enlarged calyx; septa united to the 2 valves and to the central column; seeds many, not winged.","perennial or annual herbs, conspicuously or obscurely gland-dotted. leaves opposite or whorled, simple, sessile or petiolate, often joined across at nodes. inflorescences a single flower or of racemes with flowers single in the axils of leaf-like bracts; bracteoles absent. calyx-tube 5-angled, shortly 5-toothed; corolla 5-lobed, more or less rotate or 2-lipped, tube symmetrical at base, neither swollen nor spurred, upper lip 2-lobed, lower 3-lobed, longer, with a palate; stamens 4, in pairs of unequal length, filaments not spurred, anthers of each pair joined, with 2 confluent but divergent locules, staminodes absent; stigma with 2 broad equal flaps, receptive on the inner surface and irritable, closing together when touched. capsule loculicidal, included in enlarged calyx; septa united to the 2 valves and to the central column; seeds many, not winged.","perennial or annual herbs, conspicuously or obscurely gland-dotted.",,"leaves opposite or whorled, simple, sessile or petiolate, often joined across at nodes.","inflorescences a single flower or of racemes with flowers single in the axils of leaf-like bracts; bracteoles absent. calyx-tube 5-angled, shortly 5-toothed; corolla 5-lobed, more or less rotate or 2-lipped, tube symmetrical at base, neither swollen nor spurred, upper lip 2-lobed, lower 3-lobed, longer, with a palate; stamens 4, in pairs of unequal length, filaments not spurred, anthers of each pair joined, with 2 confluent but divergent locules, staminodes absent; stigma with 2 broad equal flaps, receptive on the inner surface and irritable, closing together when touched.","capsule loculicidal, included in enlarged calyx; septa united to the 2 valves and to the central column;","seeds many, not winged.",
"Clematis decipiens","Dioecious, woody climber or trailer, ascending to c. 5 m high. Leaves opposite; adult leaves biternate to triternate (with 12–15 leaflets); petioles often twining or twisting; ultimate leaflets ovate to lanceolate, glabresecent; margins entire or 3-lobed; terminal leaflet 1.2–4.5 cm long, 1.5–5 mm wide. Flowers in short axillary or terminal panicles. Sepals white to pale yellow, oblong to narrowly ovate, c. 2–3 cm long, glabrous on upper surface, pubescent below; male flowers with anthers 0.5–1 mm long with no terminal appendage; female flowers usually with a few staminodes. Achenes flattened, ovate, 4–5 mm long, glabrous or shortly hirsute, margins thickened and warty; awn plumose, 3–5 mm long. Flowers July–Oct.","dioecious, woody climber or trailer, ascending to circa 5 m high. leaves opposite; adult leaves biternate to triternate (with 12–15 leaflets); petioles often twining or twisting; ultimate leaflets ovate to lanceolate, glabresecent; margins entire or 3-lobed; terminal leaflet 1.2–4.5 cm long, 1.5–5 mm wide. flowers in short axillary or terminal panicles. sepals white to pale yellow, oblong to narrowly ovate, circa 2–3 cm long, glabrous on upper surface, pubescent below; male flowers with anthers 0.5–1 mm long with no terminal appendage; female flowers usually with a few staminodes. achenes flattened, ovate, 4–5 mm long, glabrous or shortly hirsute, margins thickened and warty; awn plumose, 3–5 mm long. flowers july–oct.","dioecious, woody climber or trailer, ascending to circa 5 m high.",,"leaves opposite; adult leaves biternate to triternate (with 12–15 leaflets); petioles often twining or twisting; ultimate leaflets ovate to lanceolate, glabresecent; margins entire or 3-lobed; terminal leaflet 1.2–4.5 cm long, 1.5–5 mm wide.","flowers in short axillary or terminal panicles. sepals white to pale yellow, oblong to narrowly ovate, circa 2–3 cm long, glabrous on upper surface, pubescent below; male flowers with anthers 0.5–1 mm long with no terminal appendage; female flowers usually with a few staminodes. achenes flattened, ovate, 4–5 mm long, glabrous or shortly hirsute, margins thickened and warty; flowers july–oct.","awn plumose, 3–5 mm long.",,
"Pomaderris phylicifolia subsp. phylicifolia","Slender shrubs, 1–2.5 m high; branchlets greyish, pubescent or villous with simple and stellate hairs. Leaves narrow-ovate, narrow-elliptic or narrow-obovate, 6–15 mm long, 1–6 mm wide, obtuse, margins entire or sometimes sinuate, recurved or revolute, upper surface sparsely to moderately hispid with simple hairs, secondary veins slightly impressed; lower surface with dense stellate hairs overlain by sparse, longer, simple hairs (denser over veins); stipules 1–6 mm long, persistent. Flowers in small axillary clusters, crowded toward branch-tips; bracts deciduous. Flowers cream to yellow; externally greyish, densely pubescent, with simple hairs overlaying stellate hairs; pedicels 0.5–2.5 mm long; hypanthium 0.5–1 mm long; sepals 1.2–2 mm long, deciduous; petals absent; disc absent; ovary half-inferior, summit simple-pubescent, style branched in middle or upper third. Operculum membranous, subequal to mericarp. Flowers Nov.","slender shrubs, 1–2.5 m high; branchlets greyish, pubescent or villous with simple and stellate hairs. leaves narrow-ovate, narrow-elliptic or narrow-obovate, 6–15 mm long, 1–6 mm wide, obtuse, margins entire or sometimes sinuate, recurved or revolute, upper surface sparsely to moderately hispid with simple hairs, secondary veins slightly impressed; lower surface with dense stellate hairs overlain by sparse, longer, simple hairs (denser over veins); stipules 1–6 mm long, persistent. flowers in small axillary clusters, crowded toward branch-tips; bracts deciduous. flowers cream to yellow; externally greyish, densely pubescent, with simple hairs overlaying stellate hairs; pedicels 0.5–2.5 mm long; hypanthium 0.5–1 mm long; sepals 1.2–2 mm long, deciduous; petals absent; disc absent; ovary half-inferior, summit simple-pubescent, style branched in middle or upper third. operculum membranous, subequal to mericarp. flowers nov.","slender shrubs, 1–2.5 m high;","branchlets greyish, pubescent or villous with simple and stellate hairs. stipules 1–6 mm long, persistent.","leaves narrow-ovate, narrow-elliptic or narrow-obovate, 6–15 mm long, 1–6 mm wide, obtuse, margins entire or sometimes sinuate, recurved or revolute, upper surface sparsely to moderately hispid with simple hairs, secondary veins slightly impressed; lower surface with dense stellate hairs overlain by sparse, longer, simple hairs (denser over veins);","flowers in small axillary clusters, crowded toward branch-tips; bracts deciduous. flowers cream to yellow; externally greyish, densely pubescent, with simple hairs overlaying stellate hairs; pedicels 0.5–2.5 mm long; hypanthium 0.5–1 mm long; sepals 1.2–2 mm long, deciduous; petals absent; disc absent; ovary half-inferior, summit simple-pubescent, style branched in middle or upper third. flowers nov.","operculum membranous, subequal to mericarp.",,
"Cortaderia selloana subsp. jubata","Plants female only, but apomictic and producing viable seed. Culms to 4.5 m high, normally at least twice as high as the basal tusosck; leaves bright green; sheath often densely sericeous; blade usually not turned so that the scabrous abaxial surface remains lowermost, flat, keeled beneath, coarsely scabrous on margins and nerves on lower (abaxial) surface. Inflorescence purplish (but bleaching as it ages). Spikelets with veins of glume, rachilla segments and usually lemmas purple, 3–5-flowered. Flowers Jan.–Mar.","plants female only, but apomictic and producing viable seed. culms to 4.5 m high, normally at least twice as high as the basal tusosck; leaves bright green; sheath often densely sericeous; blade usually not turned so that the scabrous abaxial surface remains lowermost, flat, keeled beneath, coarsely scabrous on margins and nerves on lower (abaxial) surface. inflorescence purplish (but bleaching as it ages). spikelets with veins of glume, rachilla segments and usually lemmas purple, 3–5-flowered. flowers jan.–mar.",,"culms to 4.5 m high, normally at least twice as high as the basal tusosck;","leaves bright green; sheath often densely sericeous; blade usually not turned so that the scabrous abaxial surface remains lowermost, flat, keeled beneath, coarsely scabrous on margins and nerves on lower (abaxial) surface. spikelets with veins of glume, rachilla segments and usually lemmas purple, 3–5-flowered.","inflorescence purplish (but bleaching as it ages). flowers jan.–mar.",,"plants female only, but apomictic and producing viable seed.",
"Mesembryanthemum cordifolium","Leaves fleshy, broadly ovate to rhombic, c. 1–2 cm long; petiole to 0.5–1 cm long. Pedicels to c. 1 cm long, elongating in fruit; larger sepals at anthesis ovate, c. 1 cm long, 0.5 cm wide; smaller sepals linear or narrowly triangular, to c. 7 mm long, 3 mm wide; sepals enlarging in fruit. Flowers 5–8 mm across. Capsule obconic, c. 10 mm long, 7 mm wide. Seeds very hard, ± circular, with a flattened dorsal ridge, prominently tuberculate, 1–1.5 mm diam. Flowers Oct.–Mar.","leaves fleshy, broadly ovate to rhombic, circa 1–2 cm long; petiole to 0.5–1 cm long. pedicels to circa 1 cm long, elongating in fruit; larger sepals at anthesis ovate, circa 1 cm long, 0.5 cm wide; smaller sepals linear or narrowly triangular, to circa 7 mm long, 3 mm wide; sepals enlarging in fruit. flowers 5–8 mm across. capsule obconic, circa 10 mm long, 7 mm wide. seeds very hard, ± circular, with a flattened dorsal ridge, prominently tuberculate, 1–1.5 mm diam. flowers oct.–mar.",,,"leaves fleshy, broadly ovate to rhombic, circa 1–2 cm long; petiole to 0.5–1 cm long.","pedicels to circa 1 cm long, elongating in fruit; larger sepals at anthesis ovate, circa 1 cm long, 0.5 cm wide; smaller sepals linear or narrowly triangular, to circa 7 mm long, 3 mm wide; sepals enlarging in fruit. flowers 5–8 mm across. flowers oct.–mar.","capsule obconic, circa 10 mm long, 7 mm wide.","seeds very hard, ± circular, with a flattened dorsal ridge, prominently tuberculate, 1–1.5 mm diam.",
"Dodonaea heteromorpha","Dioecious, erect shrub to 3 m high; branchlets angular, ribbed to flattened, glabrous. Leaves opposite or alternate, usually simple and sessile, sometimes irregularly pinnate (then shortly petiolate) with 1–10 leaflets; simple leaves linear to linear-lanceolate, 3.5–8.3 cm long, 2–5 mm wide (leaflets, if present, 0.6–3 cm long, 2–3 mm wide), acute, margins flat to revolute, glabrous, not viscid. Flowers in axillary cymes; pedicels 3.5–10(–12.5) mm long; sepals 4, ovate, 1.5–2.3 mm long, viscid, caducous; stamens 8, c. equal in length with sepals; ovary glabrous. Capsule 4-winged, transversely oblong in outline, 5–6.5 mm long, 15–25 mm wide, glabrous, wings 6.5–10 mm wide, membranous, rarely coriaceous; seeds lenticular, 1.7–2.4 mm long, black, dull, exarillate. Flowers spring and summer.","dioecious, erect shrub to 3 m high; branchlets angular, ribbed to flattened, glabrous. leaves opposite or alternate, usually simple and sessile, sometimes irregularly pinnate (then shortly petiolate) with 1–10 leaflets; simple leaves linear to linear-lanceolate, 3.5–8.3 cm long, 2–5 mm wide (leaflets, if present, 0.6–3 cm long, 2–3 mm wide), acute, margins flat to revolute, glabrous, not viscid. flowers in axillary cymes; pedicels 3.5–10(–12.5) mm long; sepals 4, ovate, 1.5–2.3 mm long, viscid, caducous; stamens 8, circa equal in length with sepals; ovary glabrous. capsule 4-winged, transversely oblong in outline, 5–6.5 mm long, 15–25 mm wide, glabrous, wings 6.5–10 mm wide, membranous, rarely coriaceous; seeds lenticular, 1.7–2.4 mm long, black, dull, exarillate. flowers spring and summer.","dioecious, erect shrub to 3 m high;","branchlets angular, ribbed to flattened, glabrous.","leaves opposite or alternate, usually simple and sessile, sometimes irregularly pinnate (then shortly petiolate) with 1–10 leaflets; simple leaves linear to linear-lanceolate, 3.5–8.3 cm long, 2–5 mm wide (leaflets, if present, 0.6–3 cm long, 2–3 mm wide), acute, margins flat to revolute, glabrous, not viscid.","flowers in axillary cymes; pedicels 3.5–10(–12.5) mm long; sepals 4, ovate, 1.5–2.3 mm long, viscid, caducous; stamens 8, circa equal in length with sepals; ovary glabrous. flowers spring and summer.","capsule 4-winged, transversely oblong in outline, 5–6.5 mm long, 15–25 mm wide, glabrous, wings 6.5–10 mm wide, membranous, rarely coriaceous;","seeds lenticular, 1.7–2.4 mm long, black, dull, exarillate.",
"Stackhousia viminea","Glabrous, non-rhizomatous perennial to 70 cm high; stems erect or ascending, rarely branched above. Leaves narrowly obovate to obovate or narrowly elliptic, 1–3.5(–5) cm long, 1–7.5 mm wide, those at base sometimes reduced to scales. Inflorescence cylindric, spike-like; flowers 1–5 at nodes, shortly pedicellate, subtended by a cluster of several ovate bracts to c. 1 mm long. Hypanthium 0.4–0.7 mm long; sepals 0.5–0.8 mm long, entire to undulate; corolla pale green to deep yellow, rarely tinged red-brown outside, tube 2.2–3.5 mm long, lobes 1.5–3 mm long, obtuse to acuminate; gynoecium 3-partite. Mericarps 1–3, broadly ovoid to broadly ellipsoid, 1.5–3 mm long, rugose to coarsely rugose-reticulate, sometimes tuberculate; basal cavity very shallow. Flowers Aug.–Dec.","glabrous, non-rhizomatous perennial to 70 cm high; stems erect or ascending, rarely branched above. leaves narrowly obovate to obovate or narrowly elliptic, 1–3.5(–5) cm long, 1–7.5 mm wide, those at base sometimes reduced to scales. inflorescence cylindric, spike-like; flowers 1–5 at nodes, shortly pedicellate, subtended by a cluster of several ovate bracts to circa 1 mm long. hypanthium 0.4–0.7 mm long; sepals 0.5–0.8 mm long, entire to undulate; corolla pale green to deep yellow, rarely tinged red-brown outside, tube 2.2–3.5 mm long, lobes 1.5–3 mm long, obtuse to acuminate; gynoecium 3-partite. mericarps 1–3, broadly ovoid to broadly ellipsoid, 1.5–3 mm long, rugose to coarsely rugose-reticulate, sometimes tuberculate; basal cavity very shallow. flowers aug.–dec.","glabrous, non-rhizomatous perennial to 70 cm high;","stems erect or ascending, rarely branched above.","leaves narrowly obovate to obovate or narrowly elliptic, 1–3.5(–5) cm long, 1–7.5 mm wide, those at base sometimes reduced to scales.","inflorescence cylindric, spike-like; flowers 1–5 at nodes, shortly pedicellate, subtended by a cluster of several ovate bracts to circa 1 mm long. hypanthium 0.4–0.7 mm long; sepals 0.5–0.8 mm long, entire to undulate; corolla pale green to deep yellow, rarely tinged red-brown outside, tube 2.2–3.5 mm long, lobes 1.5–3 mm long, obtuse to acuminate; gynoecium 3-partite. mericarps 1–3, broadly ovoid to broadly ellipsoid, 1.5–3 mm long, rugose to coarsely rugose-reticulate, sometimes tuberculate; basal cavity very shallow. flowers aug.–dec.",,,
"Discaria","Rigid shrubs. Leaves opposite, petiolate or sessile, often caducous; stipules fused at base and opposite pairs united into a short collar; simple axillary spines often present. Flowers bisexual, solitary or clustered in axils of leaves of short axillary shoots; sepals (4–)5, falling before fruit ripens; petals 5, hooded, or sometimes absent; disc prominent, largely covering the ovary summit; ovary inferior, carpels 3, style entire or slightly branched. Fruit a capsule (in Australia) or a drupe, splitting into 3 medially dehiscent segments; seeds not arillate.","rigid shrubs. leaves opposite, petiolate or sessile, often caducous; stipules fused at base and opposite pairs united into a short collar; simple axillary spines often present. flowers bisexual, solitary or clustered in axils of leaves of short axillary shoots; sepals (4–)5, falling before fruit ripens; petals 5, hooded, or sometimes absent; disc prominent, largely covering the ovary summit; ovary inferior, carpels 3, style entire or slightly branched. fruit a capsule (in australia) or a drupe, splitting into 3 medially dehiscent segments; seeds not arillate.","rigid shrubs.","stipules fused at base and opposite pairs united into a short collar; simple axillary spines often present.","leaves opposite, petiolate or sessile, often caducous;","flowers bisexual, solitary or clustered in axils of leaves of short axillary shoots; sepals (4–)5, falling before fruit ripens; petals 5, hooded, or sometimes absent; disc prominent, largely covering the ovary summit; ovary inferior, carpels 3, style entire or slightly branched.","fruit a capsule (in australia) or a drupe, splitting into 3 medially dehiscent segments;","seeds not arillate.",
"Caladenia","Terrestrial herbs, usually hairy, arising from rounded underground tubers. Leaf solitary, basal, elongate, generally linear-lanceolate or oblong, hairy, emerging from fibrous sheath close to ground. Flowering stem covered in non-glandular and glandular hairs. Flowers with column uppermost, solitary or in loose raceme of up to 10, variously coloured, on erect flowering stem with a sheathing bract at or near the middle and a closely sheathing bract under each pedicel; dorsal sepal either erect, incurved over column, or more rarely hooded, usually narrow; lateral sepals and petals usually nearly equal to dorsal sepal but flat, spreading or reflexed, rarely curving upwards. Labellum on a movable claw, generally erect at base, undivided or 3-lobed, margins often fringed or toothed; lateral lobes, when present, usually erect and clasping sides of column; mid-lobe or distal part of undivided labellum recurved; lamina with sessile or stalked calli arranged in 2 or more longitudinal rows or irregularly scattered or crowded. Column erect or incurved, more or less winged in upper part, with or without 2 sessile yellow glands at base.","terrestrial herbs, usually hairy, arising from rounded underground tubers. leaf solitary, basal, elongate, generally linear-lanceolate or oblong, hairy, emerging from fibrous sheath close to ground. floweringstem covered in non-glandular and glandular hairs. flowers with column uppermost, solitary or in loose raceme of up to 10, variously coloured, on erect floweringstem with a sheathing bract at or near the middle and a closely sheathing bract under each pedicel; dorsal sepal either erect, incurved over column, or more rarely hooded, usually narrow; lateral sepals and petals usually nearly equal to dorsal sepal but flat, spreading or reflexed, rarely curving upwards. labellum on a movable claw, generally erect at base, undivided or 3-lobed, margins often fringed or toothed; lateral lobes, when present, usually erect and clasping sides of column; mid-lobe or distal part of undivided labellum recurved; lamina with sessile or stalked calli arranged in 2 or more longitudinal rows or irregularly scattered or crowded. column erect or incurved, more or less winged in upper part, with or without 2 sessile yellow glands at base.","terrestrial herbs, usually hairy, arising from rounded underground tubers.","floweringstem covered in non-glandular and glandular hairs.","leaf solitary, basal, elongate, generally linear-lanceolate or oblong, hairy, emerging from fibrous sheath close to ground. lamina with sessile or stalked calli arranged in 2 or more longitudinal rows or irregularly scattered or crowded. column erect or incurved, more or less winged in upper part, with or without 2 sessile yellow glands at base.","flowers with column uppermost, solitary or in loose raceme of up to 10, variously coloured, on erect floweringstem with a sheathing bract at or near the middle and a closely sheathing bract under each pedicel; dorsal sepal either erect, incurved over column, or more rarely hooded, usually narrow; lateral sepals and petals usually nearly equal to dorsal sepal but flat, spreading or reflexed, rarely curving upwards. labellum on a movable claw, generally erect at base, undivided or 3-lobed, margins often fringed or toothed; lateral lobes, when present, usually erect and clasping sides of column; mid-lobe or distal part of undivided labellum recurved;",,,
"Adonis microcarpa","Erect glabrous annual to c. 50 cm high; leaves petiolate below, subsessile above, broadly obovate in outline, to 6 cm long, 4 cm wide, bi- or tripinnate with ultimate segments linear, to c. 4 mm long, 1 mm wide. Flowers solitary, terminal at the ends of branches, on an elongated peduncle c. 1–5 cm long; sepals purplish, 5–12 mm long, spreading to reflexed; petals (5–)6–8(–10), suberect to widely spreading, red or yellow with a black basal blotch, obovate, 7–12 mm long; stamens numerous, c. 5 mm long, anthers dark purple, c. 1 mm long; carpels 10–50. Achenes plump, obovoid to c. triangular in outline, c. 3 mm long, with lateral reticulate ridges, and an ascending terminal beak c. 1 mm long; receptacle elongating as achenes mature, finally to c. 2 cm long. Flowers Sep.–Oct.","erect glabrous annual to circa 50 cm high; leaves petiolate below, subsessile above, broadly obovate in outline, to 6 cm long, 4 cm wide, bi- or tripinnate with ultimate segments linear, to circa 4 mm long, 1 mm wide. flowers solitary, terminal at the ends of branches, on an elongated peduncle circa 1–5 cm long; sepals purplish, 5–12 mm long, spreading to reflexed; petals (5–)6–8(–10), suberect to widely spreading, red or yellow with a black basal blotch, obovate, 7–12 mm long; stamens numerous, circa 5 mm long, anthers dark purple, circa 1 mm long; carpels 10–50. achenes plump, obovoid to circa triangular in outline, circa 3 mm long, with lateral reticulate ridges, and an ascending terminal beak circa 1 mm long; receptacle elongating as achenes mature, finally to circa 2 cm long. flowers sep.–oct.","erect glabrous annual to circa 50 cm high;",,"leaves petiolate below, subsessile above, broadly obovate in outline, to 6 cm long, 4 cm wide, bi- or tripinnate with ultimate segments linear, to circa 4 mm long, 1 mm wide.","flowers solitary, terminal at the ends of branches, on an elongated peduncle circa 1–5 cm long; sepals purplish, 5–12 mm long, spreading to reflexed; petals (5–)6–8(–10), suberect to widely spreading, red or yellow with a black basal blotch, obovate, 7–12 mm long; stamens numerous, circa 5 mm long, anthers dark purple, circa 1 mm long; carpels 10–50. achenes plump, obovoid to circa triangular in outline, circa 3 mm long, with lateral reticulate ridges, and an ascending terminal beak circa 1 mm long; receptacle elongating as achenes mature, finally to circa 2 cm long. flowers sep.–oct.",,,
"Lasiospermum","Erect or ascending annual or perennial herbs. Leaves mostly cauline, alternate, 1- or 2-pinnatisect, rarely entire. Capitula pedunculate, radiate or discoid, solitary or paniculate, terminal; involucral bracts 2- or 3-seriate, outermost bracts shorter, otherwise ± equal, herbaceous with membranous margins and apex; receptacle flat to conical with membranous scales. Ray florets female, 1-seriate, ligulate; disc florets bisexual, campanulate; corolla 5-lobed; anthers with lanceolate apical appendage, without tails or spurs at base; style with linear, truncate branches. Cypselas obloid-ovoid, ribbed, hairy. Pappus absent.","erect or ascending annual or perennial herbs. leaves mostly cauline, alternate, 1- or 2-pinnatisect, rarely entire. capitula pedunculate, radiate or discoid, solitary or paniculate, terminal; involucral bracts 2- or 3-seriate, outermost bracts shorter, otherwise ± equal, herbaceous with membranous margins and apex; receptacle flat to conical with membranous scales. ray florets female, 1-seriate, ligulate; disc florets bisexual, campanulate; corolla 5-lobed; anthers with lanceolate apical appendage, without tails or spurs at base; style with linear, truncate branches. cypselas obloid-ovoid, ribbed, hairy. pappus absent.","erect or ascending annual or perennial herbs.",,"leaves mostly cauline, alternate, 1- or 2-pinnatisect, rarely entire.","capitula pedunculate, radiate or discoid, solitary or paniculate, terminal; involucral bracts 2- or 3-seriate, outermost bracts shorter, otherwise ± equal, herbaceous with membranous margins and apex; receptacle flat to conical with membranous scales. ray florets female, 1-seriate, ligulate; disc florets bisexual, campanulate; corolla 5-lobed; anthers with lanceolate apical appendage, without tails or spurs at base; style with linear, truncate branches.","cypselas obloid-ovoid, ribbed, hairy. pappus absent.",,
